6918157634,『旋律说唱』藏不住的甜蜜与心动,小软溪,1418990258,介绍：	我不是你第一个喜欢的人	不是你第一个牵手拥抱亲吻的人	但我希望我可以是	你遇到痛苦第一个想倾诉的人	遇到快乐第一个想分享的人	遇到挫折第一个想要依靠的人	我可以是你今生第一个相伴到老的人	,33,489483,746,3,评论
2311480037,DRB-ヒプノシスマイク-公式（持续更新）,万事胜意_鸦,587531866,介绍：	音楽原作キャラクターラッププロジェクト『ヒプノシスマイク』1st Full ALBUM 発売中5th2020年3/28.29メットライフドーム過去の WEB 記事はファボ覧に		*中王区*		±東方天乙統女OTOME TOHOTEN	CV：小林ゆう...	,144,1751756,29363,527,247
5070814755,bbno$ 魔兽世界游戏时间专属BGM,bbnomula,431485155,介绍：	the music i listen to when i play world of warcraft hhhhh wo a ni 我在玩魔兽世界时听的音乐 哈哈哈哈哈 我wo 爱a 你ni	,37,247105,3456,89,349
5203647472,火爆的 | 中文说唱你值得拥有,圈圈的呆子,430376515,介绍：	听就完事了，别bb	爆不爆我说了算	听吧 粗暴一些	,37,479655,6022,321,1
6971534393,超好听浪漫的旋律说唱,少女的喜欢_,3277385997,介绍：	注意事项:请保持快乐	,185,260533,18121,18,7
5468127585,带你发掘宝藏歌曲✨,舰长_L,569343984,介绍：	999+助力歌单☀️	为你提供优秀的中文小众歌曲	入单请私信作者	,64,1687446,19856,30,10
6607580431,爱一个人很难|情歌rap,dazzd,381977701,介绍：	上榜请私信	,15,81214,924,931,1
2679916677,『Melodic Rap』 | 令人沉醉的旋律说唱 |,HsiungTheKid,358740898,介绍：	本歌单为Melodic Rap爱好者量身定制。	Melodic Rap（旋律说唱）作为当下十分火热的说唱形式和说唱发展的未来，以抓耳的旋律以及引人入胜的flow而著称，首首精选，持续更新。	（本歌单目前暂时不接受音乐人...	,372,4084165,64300,874,328
7086586403,「说唱hiphop 【中文精选】Made in China,-烦恼的蒙太奇-,484356241,介绍：	喜欢的宝宝点个收藏会持续更新可以接受推广与合作	,680,187289,14198,30,4
5214554067,青春迷宫丨爱之龙卷风丨hiphop录音棚,MiserC,552899711,介绍：	爱情不止眼前的悲伤，也有热恋的欢愉～（持续更新）	,160,1673737,17697,16,22
6600147568,甜到你心里|rap15首,dazzd,381977701,介绍：	上榜请私信	,17,177251,3294,3572,352
2873336061,Hip-Hop旋律说唱，听你诉说这个世界,原点FM,247176530,介绍：	旋律性的说唱歌曲应该能引起很多共鸣，好听又有态度的音乐，歌词虽然有很多露骨，却以柔情的方式述说自己的态度和经历，甚至是最真实的自己，揭露的是最现实的世界，这也是Hip-Hop最有魅力的地方吧	,52,3188421,52185,623,291
7084684333,大概率她根本不会想起你,和你双排就像坐牢,3945890916,介绍：	为什么你还是常常出现在我的梦里……	,129,138292,13353,9,6
=817194122,让人想恋爱的超甜rap,是你的橘子O,291447769,介绍：	在吗？有个甜甜的恋爱想跟你谈一下	,790,1653057,21841,310,88
6614100004,北京HARDWAY成员精品歌单,T-Bet_,1365862981,介绍：	会持续增添成员推出新作品，敬请期待(｡ì _ í｡)	,13,107741,1077,820,评论
2834027258,rapper说情话!藏在宇宙星河里的浪漫,顾柒柒不难过,346769611,介绍：	前方高能预警！rapper 要开始说情话啦，这份高甜的rap合集请注意查收。	希望你的梦里有甜甜的大白兔奶糖，有不会融化的草莓冰淇淋，有温度刚好的安慕希，有刚新鲜出炉的大肉包，有新鲜的苹果汁，有黏黏的香...	,347,2102564,29573,316,141
2420981951,催眠麦克风DRB〔不含drama〕,入間-銃兎,324592005,介绍：	前面按各个组的顺序排的\(//∇//)\后面按照出碟的顺序添加，越新的曲子就是越顶上的～		简介（以下来自百度词条）		催眠麦克风(日文:ヒプノシスマイク–Division Rap Battle)是一个由KING RECORDS和EVIL L...	,89,1605073,27225,411,185
6945815983,rapper的骚情话【持续更新】,Cast-Off-Music3,4987484153,介绍：	没有完美的开始，只有just do it！	,30,121231,2133,220,4
5295292555,- Rap『恶 魔 果 实』,3shMoneyAp,449479492,介绍：	不客观目录，喜欢就多听点，纯属个人喜好	,513,1564740,23553,597,18
5069682147,每日一首小众歌,艾木皮三,1340526200,介绍：	每日一首小众歌 每日更新 欢迎投稿哦	,474,1594372,23210,346,161
6734203819,【维吾尔族说唱】UyGur Rap』,beatport乐,127574927,介绍：	维吾尔族说唱集 继续更新 ·	维吾尔族最火的rap 说唱集	,425,150010,946,11,2
3086778637,注入灵魂|当神级说唱遇上天籁HOOK,Unexplainable,453046904,介绍：	麻神+断眉	阿姆+日日	枪爷+卡妹	逻辑哥+毛刷	逻辑哥+共和	阿姆+麻辣鸡	卡迪 B+魔力红	机翼+凯拉尼	马龙+Young Thug	枪爷+BeBe	枪爷+Yungblud	XXX+马鹿马	一鸡+洗茶	麻辣鸡+小混混	DJ 景甜+比伯	机翼+猴西	...	,39,1836578,33554,304,217
5305929925,说唱 ｜ 只要笑一笑 没什么事情过不了,煎妮BoBo,395063023,介绍：	天空是绵绵的糖	就算塌下来又怎样	只要笑一笑	没什么事情过不了		原歌单名：	记得把平凡的日子 过得浪漫些	,47,1586790,14578,248,112
2644743965,【海外说唱】超级好听英文Rap歌单,棉花糖Edm,357701301,介绍：	多以西海岸说唱为主，只是选择性挑自己喜欢的歌进歌单。（随机播放，惊喜不断.）（喜欢就收藏，爱就分享.）不固定更新哈。	,148,721348,10120,86,106
6614637277,《高等rapper4》| 比赛Beat/BGM/音源大收录,幻境少女文知绣,45373159,介绍：	泡粉盛宴之高等rapper4开赛，强大导师团坐镇开启黑泡盛宴。		第一组:Simon Dominic & Loco	第二组:Changmo & Way Ched	第三组:The Quiett & YUMDDA	第四组:Jay Park & pH-1 & WOOGIE		节目已开播，相关曲目...	,85,44438,726,3,7
6691386204,我和你有一个共同点，就是都很喜欢你,饼饼今天学习了嘛,1685802164,介绍：	我和你有一个共同点，就是都很喜欢你。Yic	,100,1492568,48116,2175,9
6663187462,EMO Rap |情绪说唱| New wave | 丧,Judith_ANGEL,485795511,介绍：	坏情绪都是难免的，但生活还是要继续的，早日康复	,965,1190247,169237,1806,20
6945819874,【RAP】甜到炸裂,Cast-Off-Music3,4987484153,介绍：	时光温柔，还需你懂。生活可爱，也要你宠。	,33,175310,2597,219,4
5323122346,Hiphop（ Trap | melodic rap旋律说唱 ,秋chill的首席推歌官,413345699,介绍：	抖音:香菜小绿 无脏标E不歌单	Hiphop歌单 不都是trap	别说这首不是旋律 那首不是trap了	gfunk jazzhiphop gansta都有	会根据自己近期喜好排序 歌单禁止搬运 ———————————————————— ——...	,810,1393277,20946,299,97
2688991686,那些酒吧里放的特别拽的歌曲$,2-5R,438047742,介绍：	在酒吧里听过但是你不知道歌名的那些歌	,135,444052,5999,70,59
6607455740,你是唯一|情歌rap,dazzd,381977701,介绍：	上榜请私信	,16,60449,651,776,评论
=990015063,尝一口你就知道敲甜的rap［情歌2.0］,Aloneha,273860793,介绍：	吃到了一颗好吃的糖 想跟你的嘴分享	,132,1358626,17068,186,52
2621595367,40首「硬核」健身【核精神氮泵】,Rabbit-Run-,316039327,介绍：	歌曲都是我平时健身听的	dubstep rap 旋死 重金属	喜欢的小伙伴们点个收藏	我们深蹲到天亮		,42,689810,6965,54,80
2952963929,小鬼王琳凯唱歌合集,Luan鬼夫人,1398383841,介绍：	关于小鬼王琳凯的歌单	,33,115456,986,4,评论
6631262910,就怕rapper说情话 撒时候有甜甜的恋爱,GRU__iZa,1294496571,介绍：	原来rapper的嘴巴不只有diss 还有甜甜的kiss	,172,1317367,12080,126,52
3097267488,“爱 在 黄 昏日落 时”,涵崽ikn,1829676170,介绍：	对大部分的喜欢都是一时的 包括爱也是。	建议：听完歌单再去评论		,46,1012064,10698,90,20
6606779144,甜蜜Rap: 俘获你的芳心只需要一个beat,钟泽希,59525119,介绍：	恰好路口，你也在等着那个红绿灯； 		恰好今天，你也听着那首我喜欢的歌；		恰好旅途，你也经过那个车站。 		你纠结，我恰好笃定； 		你难过，我恰好能哄你开心； 		你失眠，我恰好陪你一起醒着。	,19,175344,1393,18,8
6656946202,姜云升（未发歌 -架歌 写废歌）,匀升Y,1960306301,介绍：	喜欢姜云升/rap的小盆友们进来来康康哦	姜云升你是我第一个喜欢的rapper	四年啦 你终于火啦！！冲冲冲	给我红到西海岸！！！	《教父》《向前》还有直播时候写废的歌都可以在节目上找到或者去B站找	,101,1307822,36987,457,102
2523624603,迷幻Trap|嘻哈毒鸡汤,SteveRillex,395293841,介绍：	最早的“Trap”在俚语里指的是毒品交易的地方和难以挣脱的生存环境，这个词起源于亚特兰大，Dungeon Family， Outkast， Goodie Mob和Ghetto Mafia等黑人嘻哈歌手是最早在音乐内容加入“Trap”的歌手。歌迷和...	,113,5820267,82341,1141,343
6975738864,旧派说唱 | Old School,云音乐说唱专区,3856379473,介绍：	旧派说唱（Old School）时期通常指1979-1984年内的说唱音乐，在得到70年代多位DJ（包括Kool DJ Herc、Grandmaster Flash、Afrika Bambaataa等）技术上的革新后，结合Breakbeat（碎拍）、Scratching（搓碟）...	,84,6848,40,0,1
2313914132,lil jet 豆芽 姜云升 马思唯 法老,云朵西柚,586935975,介绍：	你应该知道我这么帅只会出现在动漫	,137,1219295,18493,122,57
6610703103,东京街头嘻哈正在入侵,Zxy在向下扎根,443546368,介绍：	以往和传统流行市场所认可的流派相比，hip-hop仍旧只是个外来者。不过近几年，日本hip-hop文化的兴起令人感到十分欣喜。		不仅如此，如今日本各大城市可供选择的说唱类型呈现出多元化的趋势。Hip-hop最早通...	,45,149926,6882,2725,3
7026959311,甜蜜Hip-hop｜夏日粉色心动,MATcH是火柴,5049214871,介绍：	你是我无限脑海和永恒时间的嚣张份子，而无限与永恒是我与你能共享的唯一。cr. 网络		——2021.4.29/22:39	,28,64111,660,9,2
2246029783,R&B「中文说唱」旋律控-说唱叙事,戴草帽的香克斯,121872884,介绍：	收藏最宝藏的说唱旋律	,97,1210013,12915,88,12
2452114012,超甜/只可私藏 不能共享,等你的双眼陪我看世界,399754502,介绍：	嘴甜是因为心甜，心甜是因为你在里面	,73,2136533,30801,355,74
6682411138,Lil Nas X（李娜叉）|无重复收录,子半天胜,431018448,介绍：	李娜叉所有歌曲，持续更新……	,29,104822,1118,6,17
6662878509,即刻律动 • 节奏当道 | R&B/Trap/Hip-Hop*,Bronkent,137455276,介绍：	这是一个杂烩向歌单 主要收录如下*	收录曲风包括: Rap，Trap，Hip-Hop，R&B，Future Bass，Dance-Pop*	每一首都是个人精选 只为解决您的歌荒*	新旧歌曲同步交叉 顺序较乱 还请谅解*	可随机/循环播放 惊喜宝藏多...	,1245,1196786,12922,306,40
5363801096,2020 Billboard 说唱年榜收录,云音乐说唱专区,3856379473,介绍：	2020年 Billboard年榜说唱最热单曲收录，歌单顺序根据排名决定	,51,901171,8548,73,52
6942269212,为你赴汤蹈火｜饶过舌却绕不过你,Cast-Off-Music3,4987484153,介绍：	饶过舌，绕过全世界，却绕不过你！！！	,39,130026,2309,218,13
6636093831,rapper的情话，是你永远猜不透的谜语,71192_,1765683924,介绍：	来评论区写下你们的甜蜜日记	,353,1153424,11958,92,101
2689902290,♥︎ 超 甜 rap 想 和 你 坠 入 爱 河 ♥︎,站在月亮上的少女,401377310,介绍：	甜甜的恋爱很快就会轮到你啦	2021一定会是美好的一年	,52,6568553,84742,926,220
5321504769,【☞新疆新说唱-RaP♛♪】★Mung KuY,KOMPAS_,1542549692,介绍：	【★】♛新疆新说唱来了-喜欢的来听 ♛【★】MuNG Kuy	,107,224992,1345,14,5
6773453509,『说唱』清晨/日暮/落日/海风/晚霞/皆予你,肆玖新青年,383335179,介绍：	好听的旋律说唱	每天都会增加新歌	姜云升	刘聪	乃万	黄礼格	马思维	Santa-SA / 马也	蜡笔小新	Copy / BT07_PZ	大年	林达浪	Plggu	幼稚园杀手	LKF34	前男友	王以太	XMASwu	GS.L	KaFe Fu	...	...	...!	大家点...	,308,1094132,11549,99,43
6654071246,Beattle beat丨上等好货丨freestyle 伴奏,一个EDA,374150187,介绍：	Battle beat	都是自选好货	用的时候记得收藏	下次方便找到我这个宝藏歌单	,34,14694,2406,1,评论
5369148099,【精选】Boombap Old school说唱伴奏 Rap,西蒙的孩子,1464389727,介绍：	精选优质的 Boombap 伴奏		各位Rappper 抓紧收藏		持续更新—狠货源源不断		制作人们拿出优秀的作品踊跃投稿	,12,41540,505,228,评论
