歌曲ID,歌单标题,创建者昵称,创建者id,介绍,歌曲数量,播放量,添加到播放列表次数,分享次数,评论数
6600143502,甜系rap|甜到你心里,dazzd,381977701,介绍：	上榜请私信	,16,530601,3345,3591,1012
2356473597,“甜味 旋律 Rap情歌”,张以晨_,392078662,介绍：	在什么都善变的世间，我想和你看一看永远		歌单支持投稿	,397,2574966,35081,450,125
2900520316,【说唱】从地上到underground hiphop,HC-zagie,1444042361,介绍：	推歌进群等活动加v：lxqcsjwlkq1220 近期建交流群 不定期更新	,208,1071845,13928,145,100
6708035697,【RAP】Dear God.,M7_Rye,3897820119,介绍：	哥谭市五好居民。	不分类 啥类型也有，	,1209,14144,235,104,1
7067950752,WLAN Forever,Vison橙,565289212,介绍：	把我们爱意像WLAN信号一样传播	这里是WLAN说唱团体	,71,127,9,5,评论
5395214137,trap，hiphop合集一 | 嘻哈一种生活的态度,21m的意大利炮,262060227,介绍：	"生命是一团欲望，欲望不能满足便痛苦，满足便无聊，人生就在痛苦和无聊之间摇摆。"	,125,65296,904,7,12
2695101341,[拒绝瞌睡] 跟着节拍抖腿的嘻哈音乐,原创君,201586,介绍：	抖腿说唱 / 专治各种瞌睡	戴上耳机 我就是这条gai最酷的崽	,30,9997880,78967,542,153
3119595459,国产hiphop百听不厌,Double_Mini,421421612,介绍：	( 接投稿 ) 带给你非常有质感的国产说唱单曲百听不厌的好音乐每天用心更新希望大家多多收藏评论多多支持	,452,20994118,125830,4327,461
5070074208,到点了，该emo了,WATCHINGINGLOVE,303366015,介绍：	到点了，该emo了 。自己喜欢的 喜欢就听 不喜欢就算了	,245,2536853,12328,373,113
6600101145,浪漫说唱|撩动你的心,dazzd,381977701,介绍：	上榜请私信	,17,256576,3272,3586,320
5106401942,贝贝开着粉红法拉利,Rest72_,1835719964,介绍：	持续更新	,62,1066084,10903,58,13
5443776502,cheatcode-lil york mixtape No.2,Najeremy,546466019,介绍：	lil york 2021 第二张唱片登陆网易云了喜欢的朋友可以留言分享收藏三连击，谢谢 shut out to cheatcode cc 4 life slat	,5,100878,2047,0,评论
4964806727,「新生代」蒙古说唱,BaynErhet,378028169,介绍：	封面是；蒙古国 Uka 和 Don Dior 		蒙古说唱 新秀	Don Dior，Vandebo，Thunder Z，Ginjin，Maaraa，Roockie.，Fla，AM-C，Mrs M，Loce，168，Wolfizm，Wondha Mountain	,289,71037,1274,16,3
2423939332,旋律说唱丨循环系列,Selected音乐,1520920706,介绍：	(接投稿)因为专一 所以专业 让你感受最动听的旋律说唱 持续更新	,729,20931796,185832,4460,530
4948845769,『进 口 狠 货』& 极品 SWAY精选,韩某的可乐加冰,1724067555,介绍：	走路不要听 会拽的跟二五八万似的……	,103,172975,963,15,11
6700242542,[雷击顿唱片行] 让你扭动身体的异域节奏,云音乐官方歌单,1463586082,介绍：	雷击顿（Reggaeton）是一种新的音乐形式，产生于波多黎各，结合了传统Salsa音乐，牙买加的Reggae，以及Hip Hop等多种音乐风格为一体。有节奏的鼓点与畅酣的说唱很容易带动人的积极性，不自觉的想要扭腰摆臀...	,30,1344490,7902,68,25
6589049163,BOOMSHAKE丨微醺Hiphop,tan4ko,105735227,介绍：	酒精允许一切情绪	,152,1021249,16674,298,42
5290830261,让你心动的说唱伴奏rap beat,ZiJianHan,271715824,介绍：	说唱是流行音乐的一种表现形式，是指有节奏地说话的特殊唱歌形式。发源于纽约贫困黑人聚居区。它以在机械的节奏声的背景下，快速地诉说一连串押韵的诗句为特征。	,44,99975,1681,2,2
6752221322,“你真的甘心错过吗？”,于懿1,1669960899,介绍：	我时常问自己是否真的听懂这些歌，为何总是揪着过去不放手。我真的不甘心.....可又有什么用呢？前方的路漆黑一片，不知道危险躲藏在哪里，只剩我一个人被孤独无限拉扯。		我真的不能想象没有你的未来........	,108,2493575,11723,567,120
6813607109,Travis Scott !!!,HC-zagie,1444042361,介绍：	钩子一反 听Travis Scott更带感 推歌v：lxwcsjwlkq1220	,67,17697,224,0,评论
3119596483,中文说唱丨宝藏系列,Top嘉熙,421419695,介绍：	MADE IN CHINA 中文说唱已崛起	,387,20375660,116473,3277,180
6616811098,Rapper说情话,leicoattraversiamo_,534388127,介绍：	Rapper说情话 Rapper说情话 Rapper说情话	,20,11737,232,26,2
5395488578,[一周欧美说唱] 枪姐联手Push拉开新专序幕，果汁遗作重现旋律荣光,云音乐官方歌单,1463586082,介绍：	编辑精选欧美说唱新歌	每周五更新 收藏订阅 一起SWAG！		,50,4558247,29301,145,86
2894678520,情话 Rapper 收获你的少女心,Doki少女鹿安然,1854050928,介绍：	实验证明Hip-hop很容易收获少女心 Skr…	,144,995696,10419,105,31
6945850699,【RAP】甜甜的戀愛循環,Cast-Off-Music3,4987484153,介绍：	戀愛循環播放，一直在循环播放。	,28,121433,2116,216,5
2195781651,不知名选手au,点击的秘密,391652836,介绍：	魅 力 男 孩 u 桑	,444,2505934,42807,237,86
4910716822,情绪英文嘻哈｜Emo Trap R&B,WhatsUpRAMS,325767093,介绍：	主要收集情绪向嘻哈音乐，以trap和r&b为主，本歌单持续更新，请关注：		情绪陷阱 Emotional Trap	旋律陷阱 Melodic Trap	流行节奏蓝调 R&B	,121,34501,508,7,4
2119378458,前方注意！精选高甜【rap】请签收,Ji_s0o,1383536319,介绍：	饶舌饶不过你	甜心不过是你		这个不mf接投稿	接投稿	,309,15856345,234577,2584,1009
5088720782,能让你“走路带风”的Rap,说唱HIPHOP,1338187188,介绍：	建议带上耳机调到最大声，注意安全	,34,74825,1817,12,18
6970792582,[Popping 练习曲] 机械律动 节奏强袭,云音乐官方歌单,1463586082,介绍：	你的专属Popping练舞管家，每日不同练习曲等你来选	,30,711566,5291,39,63
6607431117,好听的rap|不定时更新,dazzd,381977701,介绍：	上榜请私信	,16,63683,670,692,1
6742174395,小姜的浪漫主义,小葛爱刀削面子,1941569398,介绍：	＂该知道的都知道，不知道的慢慢了解”	,47,1001089,11999,99,48
2326852397,她像是含苞待放的花骨朵儿,暴雨淋在圣诞节,1470704489,介绍：	我不藏爱 我要把我想念的人公之于众 这场勇者游戏我要当勇者	,64,2468459,29877,369,235
2661706486,【精选百首】$Trap·808·$,Trap_808,134931383,介绍：	只求质量，不求数量，欢迎收藏。	这个也是我自己平时听的歌单，歌曲排序是按照我自己的喜好程度排的。	会随时更新 、替换歌曲。	Trap听的就是beat和flow，建议用低音效果强的耳机或音响来听，要不然没感觉...	,100,173139,2606,27,11
3036328969,说唱精选‖emo旋律励志炸都喜欢不纠结风格,孟琦爱吃辣,581839272,介绍：	说唱的很多风格我都很喜欢	好听的歌曲也不一定需要999+1w+	歌单收录说唱各种风格	炸的 emo的 旋律的 励志的 等	只要是高质量的歌曲都会收录	欢迎投稿高质量歌曲	发觉那些不知名rapper的歌曲		,208,13359459,85365,2181,37
6820739497,2021 XXL Freshman精选集|听这些了解他们,JoynerLucas508-507_,1787976864,介绍：	6月17日 XXL官方公布了2021 XXL Freshman Class 的11位入选者名单 他们分别是42 Dugg Blxst Coi Leray DDG Flo Milli iann dior Lakeyah Pooh Shiesty Morray Rubi Rose Toosii.	外网网友似乎对这届XXL新生...	,33,45740,647,14,9
6862602894,[中文旋律说唱] 旋律与节奏撞出轻松惬意的时光,云音乐官方歌单,1463586082,介绍：	试穿合身的衣服时	被夸拼好的积木时	沉浸自己的世界时	买到刚出炉的点心时	赶上刚进站的地铁时	遇见聊得来的朋友时	看见遍布天空的夕阳时	窝进干净温暖的房间时	感受没有噩梦的夜晚时	你都可以点开这个歌单...	,30,2170417,16498,116,34
5297939600,♛【 维吾尔说唱歌手丨Rangsiz 】♡,LiriCam,3305625059,介绍：	姓名：Xapkat-Arkin 艺术名:Rangsiz 出生地：和田地区 新疆Almas组合创始人 纯母语Rapper 独特的风格:R&b/ /UnderGround 代表作：《 Beralisang 》《 Ketting 》《 Boldi Emdi 》《 Yeraktiki San 》	,35,214589,1848,13,8
5432222238,【甜系说唱】想和你陷入浪漫的无限循环,贝塔芝麻,1461112363,介绍：	我不会去陶白白那里搜你的星座，我会花大把的时间去慢慢的了解你，一个作为独立个体的你（这段话摘自某社交软件）	这个歌单里可能有那么几首歌不算是甜甜的情歌rap 但歌词很好	大家可以在评论里写下自己想...	,194,1008771,14804,410,55
2444167008,超炸说唱伴奏（free beat）,free弗利dom,337653295,介绍：	放开了玩就完事了！	注意：如需使用beat请点进歌词或评论按照制作人要求做！	beat使用详情请咨询其制作人！	,995,2407580,28671,348,72
2579371743,中国厉害丨旋律说唱,进阶的耳朵,421430004,介绍：	你想要的你想听的都在这里中国hiphop最强旋律合集每一首都是精选	,515,11972814,129255,2330,528
6666792750,Trap 欧美 TikTok | 拽姐辣妹炸街必备,Vic2Riaaa,1512156554,介绍：	I'M SO FANCY！！！		封面：Bella Hadid/Kendall Jenner（首字母排序不分先后）	不定时更新，我爱拽姐	2020.12.9	,109,20133,281,3,1
6724237767,Emotional Rap：慢情绪节奏艺术,G-DDRRAAGGOONN,453482654,介绍：	emo的中文译名就是情绪硬核或情绪化硬核，最早是源自于摇滚的一种风格，相较于主流摇滚的大开大合，emo在风格和音乐严谨性上有着更为出色的表现。而emo放到了rap当中就变成了一种情绪化的说唱，也就是现在...	,18,40847,310,4,评论
6654532835,[打游戏听说唱] 说唱律动是你最佳游戏伴侣,云音乐官方歌单,1463586082,介绍：	说唱律动 Feat.超燃游戏	,30,3599745,27570,174,44
5235501125,姜云升/ 沙一汀EL/ 夏之禹,kowiiblue,377061498,介绍：	这才刚迈一步人生还有百里	,54,981110,13113,93,106
6600175210,爱意100%|情歌说唱,dazzd,381977701,介绍：	上榜请私信	,16,139799,3306,3558,327
6910755857,七夕限定情歌 | 甜蜜暴击 ,安抵,4876073582,介绍：	七夕来的太快了，我还没有想好一个人怎么过呢(O∆O)		emm，我jio得我还小，只过六一不过七夕嘿嘿		不过不重要啦，七夕是给可爱美好的人过的啊		对了差点忘了，祝七夕快乐哦！		♡♥(。´▽`。)♥♡	,101,211645,1459,22,21
6950428911,国产emo说唱 | 没人能感同身受,十二月的雪_026,2103569167,介绍：	短短一生，爱什么都不为过，放弃什么都没错	只有有事的时候，人才会说自己没事。	,93,2342873,10117,53,22
6636721453,Emo Rap｜往事堆砌的人生自述,worldindeed,3257045722,介绍：	EmoRap是一种用舒缓且悲伤的音乐作为铺垫		一般前奏非常的长		但到演唱时突然就瞬间释放情感歌手的声音以及歌词也非常的致郁		心碎、沮丧、自卑和自赎		给人的感觉就很颓废		大家要积极正确欣赏这类音乐		...	,36,74872,764,28,14
6952442013,[Z世代说唱] 在节奏中感受Z世代的嘻哈力量,云音乐官方歌单,1463586082,介绍：	90前的说唱歌手大多早已登入封神殿堂，90后的说唱歌手多数也成为业内代表人，满载00后说唱歌手的东风列车也已经悉数候场，有的说唱歌手潜心学习，时刻准备着展现自己的作品，有的说唱歌手也早已登上评委席...	,30,422968,2567,26,15
5339779763,《说唱新世代》学员精选作品集,偷偷的叹了口气,1590851653,介绍：	《说唱新世代》是哔哩哔哩出品的说唱音乐类节目，节目将汇聚来自全国各地的rapper，齐聚“说唱基地”。他们将通过层层公演考核，以音乐创作和竞演表现，决出代表新世代发声的“世代表达者”。 该节目由黄子...	,100,962722,12041,104,104
6600156315,甜蜜情歌|rap类,dazzd,381977701,介绍：	上榜请私信	,18,363206,3378,3617,345
6623298175,Rap｜带入感太强已经开始拽了,绉州,1739759477,介绍：	再™emo一枪蹦了你	,147,2333705,33673,411,163
4961918294,匪帮说唱丨强劲鼓点痞气十足,孔圣爷,117674583,介绍：	欧美大佬们数次在嘻哈界独占鳌头的曲目，其中包含：硬核风格、西海岸风格、TR-808节奏鼓点风格、Trap陷阱说唱风格、freestyle风格、等等！	歌单不定时更新中......	,66,77085,988,76,6
2875321368,Trap Rap R&B 杂…」,Krixx_,427713737,介绍：	杂（仅个人喜好）	,574,7148139,132961,1537,480
5295437787,说唱||请接收一封棒棒糖一样甜的情书,JealousBoy,516122350,介绍：	听过Rapper最放荡不羁的歌，	但你听过Rapper的纯情告白吗？	赶紧收下这封来自Rapper的情书，很甜很甜！		敞开心扉，唱着甜甜的歌，	外表最靓丽的Rapper往往都能唱出最甜的歌。	,80,547573,3496,91,39
2997419103,阴阳怪气/上海ZOO,屑狮子,1412607654,介绍：	阴阳怪气男团(欢天喜地好哥们)创始人为四川郫县第一大帅比怪异君，成员分别为某幻君；老番茄；中国BOY超级大猩猩；花少北丶；LexBurner。目前该男团发出了两首歌《头号玩家》（无音源）《Summer Boy》	（注...	,40,891095,28486,101,253
6607519886,情话rap|爱意满满,dazzd,381977701,介绍：	上榜请私信	,14,77383,717,682,评论
5198528623,说唱新世代||W8VES（未完待续）,臭屁脆脆鲨,550323437,介绍：	选手＋导师曲目合集		听歌指南:	1—16不定期更换的彩蛋	17—79选手比赛曲目+导师表演曲目	80—128导师曲目	129—335选手非比赛曲目		排名不分先后		彩蛋不定期更换，希望好听的歌能被更多的人听见。		比赛...	,343,2255673,30850,254,164
3086694743,APEX/节奏说唱/拥有r3kt一样流畅的身法,cAt-JustLikeJCole,374557586,介绍：	还在派派里坐牢吗？享受歌单轻松易大山！成为莎小将无畏夺取空投里主播用过的巴特雷，冲到敌人面前使用铝热剂破门！大喊飞天狙拿命来！。跟着律动掌握Super Glide成为CN r3kt，拥有Hal一样的节奏运营，像F...	,328,197331,2738,44,38
5014099772,Cherish二姗,星綏-Dr,1761709994,介绍：	姗姐唱歌爷青回！	,65,95548,1061,2,5
5269453086,「Hip-hop研究所」潮酷出街丨开启你的Swag,丨IIIIIIIIII丨,485543957,介绍：	律动的节奏感，带动你的神经，在炫酷的氛围中找到精神共鸣。		嘻哈是一种力量，诞生自阴影中，象征着美好的未来。	反映的是一种真实，是一种无畏，是一种对待事情的感性思考。		每个人都可以很嘻哈，每个人...	,317,1363197,18685,384,48
2643079957,午夜心碎俱乐部,该睡觉咯o3o,1449049469,介绍：	“...今夜心碎了吗”	,12,105733,2655,126,43
5198270733,《说唱新世代》第一季成员battle战炸曲收录,HCIPO,1381914855,介绍：	未上架歌曲:	《奥利奥少年》—江奈生	《雨夜惊魂》—圣代（仅有翻唱）	《Real Life》—Doggie（仅有翻唱）	《就算你活在二次元》—石玺彤（仅有翻唱）	《有个霸王》—精神大伙队（Feezy/孙瑄阳/RoseDoggy迪...	,73,866097,10568,73,80
6732206947,我看见前方的光消失了,若神桑,3256922790,介绍：	个人认为好听的旋律说唱，情绪rap，不限中英文	,83,21141,140,2,评论
2360205462,一个人的歌单，rap，hiphop。,拾贰零弋,1434514186,介绍：	看，你会发现一个音乐世界。	生活很苦，自己加糖。	认真生活。	,158,2182209,26938,312,127
6601275303,说唱伴奏 Trap Beat极致陷阱,丶FireX,279817241,介绍：	精选陷阱伴奏 觉得好听点个收藏	接受投稿 看准类型	遵守制作人伴奏使用规则 本身我也是个制作人 对于版权意识也很重视 希望大家多多理解 支持	,32,27181,309,2,1
2394125021,请随机播放，切歌算你赢,codeacme17,335823191,介绍：	支持歌单合作.	,699,12652020,213293,3283,2405
6945903263,愛情保衛戰的愛囚,Cast-Off-Music3,4987484153,介绍：	八月愿你拥抱属于你的郎朗秋月！！！！！！！！！！！！！！！	,24,113377,2153,224,2
3148848124,脸 红 心 跳|性感说唱让我动了心,IKAYKAI,1326649492,介绍：	迷人的嗓音在耳边环绕着	我深陷其中 无法逃掉了	,39,846416,44667,2313,13
3131480188,『全收录』ヒプノシスマイク-D.R.B-催眠麦克风,凛月輝_Rirura,1725694469,介绍：	《催眠麦克风》系列，日文原名《ヒプノシスマイク–Division Rap Battle-》，是由KING RECORDS、OTOMATE、EVIL LINE RECORDS、IDEA FACTORY共同合作在2017年9月推出的声优RAP企划。		在架空的世界背景下，...	,144,2155115,47103,507,144
4959088044,硬核「蒙古说唱」,BaynErhet,378028169,介绍：	封面是说唱歌手；Big Gee 和 Zugii	蒙古国 蒙古语说唱。	Click Click Boom说唱团体的Big Gee和Desant，Ice Top，Digital，Tatar，S&I，Rokit bay，Toonot音乐公司。J.S Bobo等等	,123,325229,5277,76,14
5101056870,节奏燃料 | 即刻启程 逃往韩系Hiphop星球,你要乖喔-,1776663236,介绍：	「收录了以AOMG/1llionaire/Indigo/Fanxy child等南韩音乐厂牌为主的说唱」		AOMG厂牌：成立于2013，全称“ABOVE ORDINARY MUSIC GROUP”，意思是追求不平凡的音乐，音乐风格偏向hiphop和R&B。旗下包含朴宰...	,45,300735,2586,41,25
5059137148,Free Beat | 优质免费说唱伴奏 | Rap Beat,--WINGYEE--,327703458,介绍：	免费且优质。	尊重版权，使用歌单内伴奏时记得以下规矩：	1.关注制作人；	2.评论；	3.出歌的歌名后缀(prod. by *制作人id*)；	4.不要手多上传了伴奏本身；	5.不要遮罩或者截掉制作人水印；	6.除非找制作人...	,396,814958,20974,5297,22
6600182205,温柔Rap|听rapper说情话,dazzd,381977701,介绍：	上榜请私信	,17,1711143,3351,3597,328
6842263243,Trap Rap ｜ 懒惰迷幻的宝藏说唱,这条平凡的狗_QwQ,109390499,介绍：	说唱音乐的风格分为很多种，包括Old School、New School、硬核说唱（Hardcore Rap）、Latin Rap（拉丁说唱 ）、黑帮说唱 (Gangsta Rap)等等，特别是在说唱的发源地美国，这里几乎每个地区都有代表自己的旗...	,80,2023377,32663,341,89
4867926094,日语说唱丨来自东瀛Rapper的Swag态度,丨IIIIIIIIII丨,485543957,介绍：	“情绪是信念的投影”		有一种嘻哈叫“日式Hip-Hop”。 日本Hip-Hop并非是独立诞生与发展的，它与其它街头时尚、电影、漫画等形式的文化有着不可分割的关系。		很多rapper都像古时的诗人，他们用自己的眼睛...	,248,639641,15080,307,132
5263926554,厂牌精选 | Empire Distribution,云音乐说唱专区,3856379473,介绍：	Empire Distribution	创建年份：2010	创建者：Ghazi Shami	音乐风格：以说唱为主	总部：旧金山	,47,30478,477,3,5
6914226430,伤感情歌 | 上一次放声大哭是为了你,mcgl41,5068666252,介绍：	突然想找你聊天 打开窗口 突然发现上次结尾是我 你没有回 欲言又止	,116,719710,10877,255,27
7058541205,快节奏 起床 化妆 赶时间用|欧美Rap,爱琳Irrintius,5202482440,介绍：	快节奏 赶时间	,22,161623,5,209,评论
6723502234,很屌的trap,_Yohan,254493389,介绍：	感谢收藏，这里都是你想要的		,136,1925847,26102,176,73
2049779104,辣妹听hiphop!!,CreepyCreepyCreepy,396664333,介绍：	[持续更新]		Close your eyes count to seven	And then You will be in heaven		谁说小姐姐不听说唱？	,270,2508346,56406,1288,152
6623345789,『 海浪遇見黄昏变成粉紅色.』,绉州,1739759477,介绍：	原来和喜欢的人说话 连声音也会偷偷变温柔.	,7,412610,4180,61,57
2623526205,灵魂伴侣姜云升,赴锦程,1513036920,介绍：	“喜欢姜云升就是同龄的女孩子喜欢的男生在球场挥洒汗水而我的男孩在地下八英里诉说他的曾经”		-	关于姜云升		个人	1.1996年出生阳历6月1日阴历四月十六双子座	2.云南昆明人	3.是Battle MC	4.拥有道士证的...	,64,714767,19585,251,159
6600113633,情话Rap|撩人心律,dazzd,381977701,介绍：	上榜请私信	,17,1077980,3334,3612,328
2155383482,正宗好货 | 请打开随机播放收听,3岁不是坏男孩,599886480,介绍：	纯正好货哈（持续更新）	歌单前三位可能会有推广，请理解	喜欢的请收藏关注一波，谢谢啦	也欢迎大家投稿	,582,1919157,35299,532,304
4952648595,【歐美】Trap/旋律說唱（切歌算我輸）持更,FsioruniQ,617551574,介绍：	Travis Scott，Gunna，6ix9ine，Tyga，Melly，Lil skies，lil xan，x，drake，kanye等，会更新（都是旋律性极强的歌曲，请用身体融入这个歌当中，有很多风格哦。）	,240,353050,6914,61,60
5241848343,嘻哈|XXL评选年度最强新人合集,索尼音乐娱乐,1718995,介绍：	★权威嘻哈文化杂志XXL 2020年度最强新人XXL Freshman Class 2020名单近日正式公布，Polo G，Lil Tjay，Mulatto，24KGoldn，Calboy，Fivio Foreign等索尼旗下嘻哈新秀赫然在列。	,26,168351,1416,32,25
2522899852,僵尸（姜云升）,三思_buzzy,1534146255,介绍：	鱼儿见识了巨龙的活法心中怎么可能甘愿遗憾呢	,47,680524,12857,74,59
6600139702,甜系rap|走心说唱,dazzd,381977701,介绍：	上榜请私信	,17,215181,3353,3583,312
2897918638,甜度99% | 饶舌歌手藏在星河里的浪漫,名侦探-柯北,44530116,介绍：	我理想的爱情：		一屋两人	三餐四季	狗在跑，	我在闹，	他在笑。		最初喜欢于样貌，	然后却沉溺于才情，	最后折服在于三观。		有钱，有爱，有孩子	他不出轨，	我不出轨，	就足够了。	醒同笑睡同床	生同房死...	,114,1857563,20923,272,84
6611168504,这里有你喜欢的欧美嗓音,Zxy在向下扎根,443546368,介绍：	RAP是美国黑人音乐中的重要组成部分，是街头文化的主要基调，是世界流行音乐中的一块“黑色巧克力”。精心收集了欧美流行说唱，好听的RAP让你一次听个够。	,34,170531,6867,2755,1
6972097062,ak1r hip-hop Music,先有趣,74141482,介绍：	Hip-hop音乐是最直接的表达方式	,22,7772,93,0,1
6952219126,午 夜 失 眠 俱 樂 部 「拒绝Emo」,马可波罗堡-,4970468530,介绍：	午 夜 失 眠 俱 樂 部 「拒绝Emo」		再也不要Emo了 		要好好学习，好好吃饭，好好工作，好好变成最好的样子		每一首都是治愈Emo的兴奋剂	,82,661192,18045,287,12
6600201291,甜味rap|情歌专场,dazzd,381977701,介绍：	上榜请私信	,16,140828,3503,3572,333
5310111557,伤感说唱rap | 忘了是怎么开始,见青山t,1358261208,介绍：	你完美地躲过了所有正常操作		所以 该怎么找到你？	,73,1822612,15285,1232,52
6607570431,制造浪漫|情歌rap,dazzd,381977701,介绍：	上榜请私信	,15,133302,762,1039,评论
=537367797,辣妹必备做个酷girl♥,kkkbaby_,357091992,介绍：	辣妹必备哦 超好听超拽！	辣辣辣 下个辣妹就是你啦❦	,1447,1768337,30690,337,126
6793847584,姜云升较全歌单,想摸摸汤臣一品,1851332769,介绍：	先下载再听！先下载！下载！下载！		这个歌单收集了很多姜鸽流落在外的歌和demo，也下架了很多，且听且珍惜！不定时更新，确定不收藏？	,85,560917,11991,122,64
5059330232,スカー藩主 SCARLXRD,IvorVincent,66640901,介绍：	Trap Metal（也被称为 ragecore， hardcore trap， industrial trap 和 scream trap）是一种融合了 Trap 音乐和重金属元素以及其他类型元素的音乐流派，如工业音乐（Instructial）。		它同 trap 一样，拥有诡...	,30,123327,2490,7,13
6860422178,伤感/Emo说唱/Sad,KIND_CL,354868458,介绍：	什么叫快乐?就是掩饰自己的悲伤对每个人微笑。		SAD: 	悲哀的;难过的;让人无法接受的;该受责备(或批评)的		EMO：全称Emotional Hardcore，中文名称情绪硬核。最初是从Hardcore Punk中派生出来的一种有着艺...	,138,1828127,10852,1366,59
6775976497,【欧美】深情说唱•将爱意投放进音乐和酒精,LiLaCphoria伊柾,409028007,介绍：	多亏还有音乐和酒精，		不然人类澎湃的爱意该往哪里投放。		酒能在高兴时助兴，在悲伤时解忧。		在无心睡眠时带来一场酣梦，		在灵感枯竭时带来酒兴。		生命注满了爱，犹如酒杯斟满了酒。		我醉与不醉是在...	,48,394760,4820,97,32
2841424429,脏标E大赏【续更】,Linskual,534084850,介绍：	E就是explicit		代表这首歌带脏话且没消音		歌词露骨		看起来酷		听起来更酷		嘻哈中很常见		翻译也调皮的不行		ps：		续更		顺便普及一下其他歌名后缀的意思：		acoustic- 不插电版本		remix- 授权的改编...	,2930,2199454,46181,730,543
6818649749,Swingman_z0,Swingman_z0,330933348,介绍：	I dreamed of death drunkenness in music.	,303,542332,29422,148,147
6759590679,【新疆Young Flow】Eskender-uxxak,Ruzaliy-,1497910647,介绍：	新疆Young Flow uxxak	,40,80407,1039,0,2
2477863140,那些好听到爆炸的说唱啊,我没有熬夜,406730196,介绍：	我们都在奔赴各自不同的人生中忙碌.	,322,1786597,26182,201,101
5362903127,总有一首感情激烈的说唱会让你热泪盈眶,JealousBoy,516122350,介绍：	听说唱不只要听旋律、韵脚、Flow，	更重要的是要了解这首歌的歌词。		也许说唱歌手	吐露心声，	示爱家人，	感恩社会，	诉说苦闷……		如果了解了一首感情激烈的说唱，	或许你会为之所动，	甚至热泪盈眶……...	,45,92104,896,29,14
3215209929,$殺気爆棚 超凶trap$,psy_扭不开的奥利奥,323774211,介绍：	开启照明弹，把他们射成肉泥	,66,404542,5720,112,18
4869244294,New wave/Emo+二次元Rap+亚trap+2d旋律说唱,SunnBoibaby,1374872338,介绍：	(｡•́__ก̀｡)纯正口味 可抑可摇 随机播放 多国语言 持续更新	,427,271348,10195,163,92
